{
  "$schema": "https://json-schema.org/draft/2020-12/schema",
  "$id": "https://github.com/aikdna/kdna/schema/checksums.schema.json",
  "title": "KDNA Checksums",
  "description": "Per-entry digests for a .kdna container. Stored as checksums.json at the container root.",
  "type": "object",
  "required": ["algorithm"],
  "additionalProperties": true,
  "$defs": {
    "sha256Digest": {
      "type": "string",
      "pattern": "^sha256:[a-f0-9]{64}$"
    },
    "sha256Value": {
      "type": "string",
      "pattern": "^[a-f0-9]{64}$"
    }
  },
  "allOf": [
    {
      "if": {
        "anyOf": [
          { "required": ["digest_profile"] },
          { "required": ["covered_entries"] }
        ]
      },
      "then": {
        "required": [
          "digest_profile",
          "digest_profile_version",
          "covered_entries",
          "manifest_digest",
          "payload_digest",
          "entry_set_digest"
        ]
      }
    }
  ],
  "properties": {
    "digest_profile": {
      "const": "kdna.digest-basis.runtime-entry-set",
      "description": "Algorithm and coverage profile for entry_set_digest."
    },
    "digest_profile_version": {
      "const": "0.1.0",
      "description": "Compatibility coordinate for the entry-set digest basis."
    },
    "covered_entries": {
      "type": "array",
      "description": "Ordered entries covered by kdna.digest-basis.runtime-entry-set.",
      "prefixItems": [
        { "const": "kdna.json" },
        { "const": "payload.kdnab" }
      ],
      "items": false,
      "minItems": 2,
      "maxItems": 2
    },
    "algorithm": {
      "type": "string",
      "description": "Hash algorithm. Phase 1 uses sha256.",
      "const": "sha256"
    },
    "manifest_digest": {
      "description": "Digest of the kdna.json entry.",
      "$ref": "#/$defs/sha256Digest"
    },
    "payload_digest": {
      "description": "Digest of the payload.kdnab entry.",
      "$ref": "#/$defs/sha256Digest"
    },
    "entry_set_digest": {
      "description": "Digest of the protected runtime entry set, combined deterministically from kdna.json and payload.kdnab entry digests.",
      "$ref": "#/$defs/sha256Digest"
    },
    "entries": {
      "type": "object",
      "description": "Per-entry digests, keyed by entry name within the container.",
      "additionalProperties": {
        "type": "object",
        "required": ["algorithm", "value"],
        "properties": {
          "algorithm": { "const": "sha256" },
          "value": { "$ref": "#/$defs/sha256Value" }
        }
      }
    }
  }
}
