{
  "digest_profile": "kdna.digest-basis.runtime-entry-set",
  "digest_profile_version": "0.1.0",
  "covered_entries": [
    "kdna.json",
    "payload.kdnab"
  ],
  "algorithm": "sha256",
  "manifest_digest": "sha256:f2a27091c6ed897fd52f48f13548d9dd27f631317a54861adea4161c426689b9",
  "payload_digest": "sha256:fcde0e2b20d84ac10b28bcf4256ba04d7be5ae69386210eb4e9577ab042d116c",
  "entry_set_digest": "sha256:0b90dfb60c4009faa47b2788db680f2befb4bf480e0cca3a470cdf54c3ff5158",
  "entries": {
    "kdna.json": {
      "algorithm": "sha256",
      "value": "f2a27091c6ed897fd52f48f13548d9dd27f631317a54861adea4161c426689b9"
    },
    "payload.kdnab": {
      "algorithm": "sha256",
      "value": "fcde0e2b20d84ac10b28bcf4256ba04d7be5ae69386210eb4e9577ab042d116c"
    }
  }
}
